,Regulatory Cluster label,TF,p-value,odds-ratio,genes targeted by TF and in cluster,genes in cluster but not targeted by TF,genes in TF but not cluster,genes not in TF or cluster,TF padj,TF logFC,Mean logFC for genes targeted by TF and in cluster,Mean logFC for genes not targeted by TF and in cluster,gene_names,p.adj
0,TPDS_TMDE,TFAP2A,0.8469063671460861,0.6534839924670434,4,1416,18,4164,2.01258754214193e-21,-0.353207999520557,-2.7459519696440577,-1.590791906802746,DBH KIT CYP11A1 CGA,0.9999999999993968
1,TPDS_TMDE,NR2F2,0.05269832015247731,8.851799576570219,3,1417,1,4181,1.12612798864757e-43,-0.63825086659475,-1.51868906949462,-1.5936188786106302,PPARA OXT APOC3,0.15523803219996413
2,TPDS_TMDE,TP53,0.9999999999993968,0.07487343131539383,3,1417,115,4067,3.97644505267409e-08,0.238690104279036,-3.1537035418235804,-1.5907521086416139,KLK3 AFP IGF1R,0.9999999999993968
3,TPDS_TMDE,HNF1A,0.08472780842148254,2.530814305920388,6,1414,7,4175,1.83724031953324e-05,-0.205147706614838,-2.2909862960273415,-1.5910375004303912,SLC22A9 ALB CYP3A4 SLC22A10 APOH UGT1A1,0.20026572899623146
4,TPDS_TMDE,HNF4A,0.6444555287885967,0.9250126736287134,11,1409,35,4147,8.78325240569214e-26,-0.531437198976817,-2.285273092915961,-1.5890193567170856,CEACAM1 AFP LDLR PCSK9 SERPINC1 APOC3 CYP3A4 ABCC6 PPARA SOAT2 CYP2B6,0.870433441480702
5,TPDE_TMDS,SP3,0.6531041925694436,0.9081440666577073,6,1063,28,4505,6.68528114306088e-05,0.116644919093851,2.5334979068369834,1.150844584796127,ADGRE5 CDKN2A DNASE2 ITGAD PLAUR KDR,0.8708055900925915
6,TPDE_TMDS,NFKB1,0.9861475799788653,0.5376203455400712,11,1058,86,4447,4.45578234588058e-48,0.41201359702745,3.1383431336608028,1.1416219035552932,SAA2 TBX21 IRF4 CXCL5 IL2 CRP BIRC5 BRCA2 EDN1 CXCL10 PLAUR,0.9999999999993968
7,TPDE_TMDS,FOSL1,0.18311209045330826,2.54859287054409,3,1066,5,4528,4.9713594065749e-09,0.457374877937257,2.64655560703104,1.1534198294651874,CDKN2A CLU PLAUR,0.3406924930840752
8,TPDE_TMDS,STAT3,0.9976431598764017,0.2745126029855616,3,1066,46,4487,0.014966241458555,0.0457384406088927,3.0107646193681368,1.1526810687910756,CRP BIRC5 VIP,0.9999999999993968
9,TPDE_TMDS,ETS1,0.9999749845287675,0.20906103286384978,4,1065,80,4453,4.38650979703114e-47,0.614405989748941,2.2306172309315,1.153535267710676,CDKN2A FLI1 CIP2A RAD51,0.9999999999993968
10,TPDE_TMDS,TP53,0.9973753235867339,0.47414362471216154,12,1057,106,4427,3.97644505267409e-08,0.238690104279036,1.8919134833556444,1.1504385257141752,BTG1 BAX TGFA NLRC4 LIG1 APCS CCNA2 RAD51 DUSP1 FDXR CDC25C TAP1,0.9999999999993968
11,TPDE_TMDS,SP1,0.9905888112433834,0.5846923196070188,18,1051,129,4404,8.762856822402429e-11,0.177580053937431,2.578901119111081,1.1389531246284874,MYBL2 ADGRE5 BAX TGFA ALOX15B FES CXCL5 IL2 AREG BIRC5 ATP1A3 CDKN2A LEP KIF2C CDC25C ITGAD CD99 PLAUR,0.9999999999993968
12,TPDE_TMDS,USF1,0.9120731338572847,0.5287288930581614,3,1066,24,4509,1.26843891787938e-12,0.145178167325904,1.7954831535110032,1.1551461427583314,CEBPA CCNB1 BRCA2,0.9999999999993968
13,TPDE_TMDS,CTCF,0.9906359294103099,0.3328972054902735,3,1066,38,4495,1.6173665678334301e-15,0.238267853589124,3.36796446122958,1.1519565255012958,CDKN2A ACKR3 MCM10,0.9999999999993968
14,TPDE_TMDS,AR,0.998613646794055,0.29493451939708426,4,1065,57,4476,9.64284324854577e-08,0.219801156064963,1.3519808154519226,1.1559131741125153,PTPRM FAM13A QSOX1 ORM2,0.9999999999993968
15,TPDE_TMDS,RELA,0.9651763460068999,0.5850645262826566,10,1059,72,4461,9.72608286814249e-39,0.234476733788806,2.986659316217686,1.1440088324985926,SAA2 TBX21 IRF4 CXCL5 IL2 BIRC5 BRCA2 EDN1 CXCL10 PLAUR,0.9999999999993968
16,TPDE_TMDS,EGR1,0.9606110121420146,0.5273988711194731,6,1063,48,4485,3.25334724953471e-07,0.189255434634112,1.690011953335062,1.1542733894851591,SPRY1 BAX TCF4 IL2 AREG PLAUR,0.9999999999993968
17,TPDE_TMDS,STAT1,0.9999999913918737,0.22060309973045822,9,1060,168,4365,8.47761324160248e-46,0.911076267529669,2.1590497528865833,1.1503164608446204,TBX21 BAX PTTG1IP HLA-DRB1 TNFSF11 EDN1 CXCL10 VIP TAP1,0.9999999999993968
18,TPDE_TMDS,CEBPA,0.9975644632939694,0.3706214376625533,6,1063,68,4465,4.56409218857457e-19,0.430720529059205,2.32318224874,1.1516995264957082,FGA E2F2 FOXA2 LEP EDN1 CCNB1,0.9999999999993968
19,TPDE_TMDS,JUN,0.9991891203926188,0.24251334968970992,3,1066,52,4481,9.80214761046781e-22,0.396769289150696,1.9576045773392767,1.1548172960568543,EDN1 PLAUR RHOB,0.9999999999993968
20,TPDE_TMDS,SPI1,0.9993244895768341,0.3040209218698921,5,1064,69,4464,2.01922340927798e-50,0.794701679252066,2.199316014252686,1.1529119935875707,FES CDKN2A FLI1 VIP CTSS,0.9999999999993968
21,TPDE_TMDS,HIF1A,0.9402514787017965,0.6702929771650151,14,1055,88,4445,5.29776789954827e-24,0.666442473694808,1.852186484500012,1.1498072096846765,BAX FOXM1 COX4I2 BIRC5 ALAS2 LEP TUBB3 EDN1 ANKRD37 BNIP3 STC2 PLAUR AURKA CYGB,0.9999999999993968
22,TPDS,TFAP2A,0.015069746257058,3.5508911819887428,6,533,16,5047,2.01258754214193e-21,-0.353207999520557,-1.6440808699344915,-2.28408180301041,OAT CRABP2 PRKCA GALNT3 L1CAM SMPD1,0.06530223378058467
23,TPDS,HNF1A,0.029956400339261648,4.198546209761163,4,535,9,5054,1.83724031953324e-05,-0.205147706614838,-1.706752623651545,-2.281220702298223,UGT2B7 UGT1A9 HNF4A MTTP,0.10742984949252453
24,TPDS,HNF4A,0.00026947662864573794,3.767139071321581,13,526,33,5030,8.78325240569214e-26,-0.531437198976817,-2.4391545638678522,-2.2729488153875916,UGT2B7 UGT1A9 PCK2 ANK3 SLC22A6 MME ALDH6A1 EPHX2 ALDOB EFHD1 CYP8B1 EBP BPHL,0.004670928229859457
25,MDE,SP3,0.10286178592841833,2.1690496215306982,5,410,29,5158,6.68528114306088e-05,0.116644919093851,2.9231265900027865,2.1026583499119718,BTK IGFBP3 VEGFA CCND1 COL1A1,0.23255708122946753
26,MDE,SMAD3,0.055744284095030266,3.145377128953771,4,411,16,5171,0.0016646813909172,0.075823141555797,2.10995960980447,2.1125686568727606,MET COL1A1 AHR VEGFA,0.1566866363752202
27,MDE,NFKB1,0.0018339490588637015,2.5278009839413347,16,399,81,5106,4.45578234588058e-48,0.41201359702745,2.124765491152136,2.1120534049009727,HLA-F HMOX1 SOD2 FAS TNFRSF10B ICAM1 B2M CD40 VEGFA CCND1 EGFR ALOX5AP VIM MMP14 VWF VCAM1,0.018574094026435527
28,MDE,STAT3,0.06721730313904156,2.1017156862745097,7,408,42,5145,0.014966241458555,0.0457384406088927,2.6314194330791776,2.1036412264273734,HMOX1 STAT1 VEGFA PRF1 CCND1 EGFR NNMT,0.17924614170411082
29,MDE,ETS1,8.098205575936165e-06,3.7808080808080806,19,396,65,5122,4.38650979703114e-47,0.614405989748941,2.321415559922913,2.102521870644917,CCND1 CDH13 OAS2 CD8A FAS CD53 RUNX1 HMOX1 CXCR4 TNFRSF10B VEGFA COL1A1 LCP1 PCSK6 JAK3 MET ASAP1 WAS VWF,0.0002807377932991204
30,MDE,MYB,0.05373624191537219,4.189320388349515,3,412,9,5178,0.0502692663394061,0.170321666067363,1.7433295262231365,2.1152319607651773,NR3C1 COL1A1 WAS,0.15523803219996413
31,MDE,FOS,0.041025432157546775,2.3880498145204028,7,408,37,5150,0.0224714868178633,0.128423284470485,2.8841087939969983,2.09930586974496,TNFAIP6 FAS HLA-DRA VEGFA CSTA NEFL NR3C1,0.133332654512027
32,MDE,TP53,0.05243758894586351,1.7063591022443891,14,401,104,5083,3.97644505267409e-08,0.238690104279036,2.141229055196825,2.111542019055279,PYCARD VCAN FAS SH2D1A ADA STAT1 TNFRSF10B CAV1 IGFBP3 CASP1 NDRG1 CDH13 IFI16 EGFR,0.15523803219996413
33,MDE,IRF1,0.18104838558961148,2.214448886350657,3,412,17,5170,8.63331708031588e-08,0.378570602762278,2.002751496665453,2.113342965834772,TAP2 PSMB9 CD40,0.3406924930840752
34,MDE,SP1,0.002516316735690027,2.1408629441624365,21,394,126,5061,8.762856822402429e-11,0.177580053937431,2.1401758531039747,2.1110707195399465,BTK CD44 CCND1 MMP14 CD163 FN1 LDHA ALDOA FAS ADA NR3C1 SPI1 TNFRSF10B CAV1 VEGFA CDK1 MNDA ABCC3 IGFBP3 MET VIM,0.021123957967862334
35,MDE,USF1,0.002811129757907009,4.432475490196079,7,408,20,5167,1.26843891787938e-12,0.145178167325904,2.0633966233104255,2.1133867158106607,HMOX1 P4HA1 CXCR4 B2M ISG20 CD2 PTPN6,0.021123957967862334
36,MDE,AR,0.034162112614413195,2.189039408866995,9,406,52,5135,9.64284324854577e-08,0.219801156064963,2.269688918057817,2.1090599905206946,IFI35 AKR1B1 HK2 VEGFA IGFBP3 NDRG1 STK39 EGFR HLA-E,0.11842865706329908
37,MDE,RELA,0.07959260089267148,1.7541152263374487,10,405,72,5115,9.72608286814249e-39,0.234476733788806,2.067910023528193,2.113645570811458,SOD2 CXCR4 TNFRSF10B ICAM1 CD40 VEGFA CCND1 EGFR MMP14 VCAM1,0.19564311367449774
38,MDE,ERG,0.0008677454788191863,16.817518248175183,4,411,3,5184,1.23857558064242e-13,0.314785016340096,2.62033738878598,2.10760147654204,CDH5 VIM HMOX1 VWF,0.011280691224649421
39,MDE,EGR1,0.0055679696069934215,2.8860830527497194,10,405,44,5143,3.25334724953471e-07,0.189255434634112,2.3961174607612983,2.105541683472369,FN1 CD44 AKR1B1 VEGFA ANGPTL4 CCND1 CDH13 EGFR SLC1A4 MMP14,0.036191802445457236
40,MDE,STAT1,0.0011962923694279924,2.1233974358974357,25,390,152,5035,8.47761324160248e-46,0.911076267529669,2.140804596179107,2.110731901306268,IGFLR1 NMI SCARB1 OAS3 CCND1 EGFR OAS2 KIF2A FAS ICAM1 HMOX1 PSMB9 IFI35 HLA-DMB OAS1 CASP4 CD40 VEGFA ISG20 COL1A1 FCGR3A IGFBP3 PRF1 MET HLA-E,0.013823822935612356
41,MDE,POU2F1,0.01635495370003053,5.038442822384428,4,411,10,5177,3.44946556050019e-14,0.143195695792882,2.6404675264991777,2.1074055627930064,CCND1 VWF HLA-DRA SPI1,0.068036607392127
42,MDE,CEBPA,7.561777067564981e-05,3.546106645925158,16,399,58,5129,4.56409218857457e-19,0.430720529059205,2.482383467244985,2.0977128344310847,S100A9 TOP2A ITGB2 FN1 KCNMA1 FAS HP MSR1 ICAM1 ENPP3 SMYD2 CCND1 CDH13 ALOX5AP GAPDH SPI1,0.0019660620375668947
43,MDE,USF2,0.000672765146730601,7.594621026894866,6,409,10,5177,6.513602018301431e-09,0.110473909864558,2.0512167732999966,2.1134431681518886,HMOX1 P4HA1 CXCR4 B2M CD2 PTPN6,0.009995367894283215
44,MDE,RUNX1,0.00017467837111409228,10.855745721271393,6,409,7,5180,2.47658348550406e-42,0.747238027088575,2.03897223840541,2.1136227945806603,ITGB2 FYB1 LCP2 LGALS3 CSF1R SPI1,0.003633310119173119
45,MDE,JUN,0.00196456763741145,3.182549504950495,11,404,44,5143,9.80214761046781e-22,0.396769289150696,2.231380182041427,2.1093078574541253,CD44 FAS CYP2J2 ICAM1 CSTA NR3C1 CCND1 EGFR VIM SPI1 VCAM1,0.018574094026435527
46,MDE,CREB1,0.010263749296309115,3.789975550122249,6,409,20,5167,5.870639375542189e-18,0.218107377384262,2.6854236203548836,2.104139400224433,FN1 CXCR4 HLA-DOB HLA-DRA VEGFA CCND1,0.052995733773803747
47,MDE,SPI1,7.792989602546989e-09,5.527989821882952,22,393,52,5135,2.01922340927798e-50,0.794701679252066,2.1872294922444038,2.1083626147189456,BTK SCARB1 LSP1 LCP2 PTPRE VAV1 CSF1R TBXAS1 CD163 CD53 ICAM1 RUNX1 TYROBP NR3C1 ITGB2 NCF2 MSR1 B2M CD40 MNDA KCNMA1 WAS,8.104709186648868e-07
48,MDE,CEBPB,0.20039098097737537,2.091019417475728,3,412,18,5169,3.93915495535251e-23,0.545152846372721,4.345185675026726,2.0962864062835975,S100A9 HP TNFAIP6,0.35932175899391444
49,MDE,HIF1A,3.6210621997488285e-06,3.5736005089058525,22,393,80,5107,5.29776789954827e-24,0.666442473694808,2.5095548683377724,2.090318954988528,SLC2A1 LGALS1 HK2 LOX CD36 CDH13 ENO2 MMP14 LDHA ALDOA NR3C1 PKM ITGB2 HMOX1 CXCR4 NAMPT VEGFA BHLHE41 FHL1 MET PFKP GAPDH,0.00018829523438693908
50,TPDE,RARA,0.028828233075970044,5.249015748031496,3,254,12,5333,5.38152239088031e-33,0.574999243677336,1.9783004955856967,2.0049081824707646,ETS1 SCD CDKN1A,0.10707629428217445
51,TPDE,SMAD3,0.011720210353821982,5.265810276679842,4,253,16,5329,0.0016646813909172,0.075823141555797,2.14963569656445,2.00230449426116,SERPINE1 COL3A1 CDKN1A MMP9,0.052995733773803747
52,TPDE,NFKB1,0.075958213119081,1.897387302017057,8,249,89,5256,4.45578234588058e-48,0.41201359702745,2.326469771282146,1.9942563119039125,SERPINE1 TLR2 BIRC3 F8 CD74 TNFAIP3 TFPI2 MMP9,0.19267449181425425
53,TPDE,STAT3,0.39188232859935634,1.3605785689832248,3,254,46,5299,0.014966241458555,0.0457384406088927,1.8742962958854432,2.0061365785302163,CD274 BIRC3 CDKN1A,0.6175115480959554
54,TPDE,ETS1,0.037812948054958606,2.227436060029592,8,249,76,5269,4.38650979703114e-47,0.614405989748941,2.490701418088692,1.9889797931310111,ITGA5 CD4 CDKN1A ITGA4 FLT1 ANGPT2 LCK MMP9,0.12685634186179662
55,TPDE,FOS,0.14122209463838833,2.0968379446640317,4,253,40,5305,0.0224714868178633,0.128423284470485,2.1620924458491553,2.0021075496084375,RUNX2 ITGA5 CDKN1A MMP9,0.28817774531954593
56,TPDE,TP53,0.043532402647190084,1.9631878842405157,10,247,108,5237,3.97644505267409e-08,0.238690104279036,2.158824344622212,1.9983535886158266,SERPINE1 TGFB1 TRIM22 MKI67 DDB2 CDKN1A FBLN2 ALOX5 FLT1 GPNMB,0.13719302652447785
57,TPDE,IRF1,0.011720210353821982,5.265810276679842,4,253,16,5329,8.63331708031588e-08,0.378570602762278,2.9358706034070376,1.989873902848629,IFIT3 CYBB HLA-A HLA-G,0.052995733773803747
58,TPDE,SP1,0.0028436097264430064,2.447877535687453,15,242,132,5213,8.762856822402429e-11,0.177580053937431,2.9533043781466546,1.9457934469509566,CDKN2C SERPINE1 ITGA5 TGFB1 TFPI2 TPI1 CDKN1A GJA1 ACAN ALOX5 COL1A2 CA9 HLA-G ITGAX MMP9,0.021123957967862334
59,TPDE,EPAS1,0.009007032456562855,9.006749156355456,3,254,7,5338,3.984095469298899e-12,0.527854460189696,4.702679425352856,1.9727304785758768,CA9 SERPINE1 FLT1,0.04930165134118616
60,TPDE,RELA,0.17313788599331723,1.6572656741455232,6,251,76,5269,9.72608286814249e-39,0.234476733788806,2.3103551531874102,1.9972886410964417,SERPINE1 BIRC3 CDKN1A CD74 TNFAIP3 MMP9,0.3397422668548112
61,TPDE,EGR1,0.01101524654152475,3.156255319148936,7,250,47,5298,3.25334724953471e-07,0.189255434634112,1.9691701827950543,2.0055895542190636,SERPINE1 TGFB1 CDKN1A CEBPB ALOX5 FLT1 TFPI2,0.052995733773803747
62,TPDE,STAT1,0.006908176249870683,2.1376768639983506,16,241,161,5184,8.47761324160248e-46,0.911076267529669,2.0211547362409648,2.003498357072514,IFITM3 IFIT3 GBP1 ISG15 CD274 CDKN1A MX1 OASL IDO1 BST2 CXCL9 COL1A2 FCGR1A TLR3 PARP14 S100A10,0.03991390722147506
63,TPDE,CEBPA,0.12262349667020782,1.85505038668854,6,251,68,5277,4.56409218857457e-19,0.430720529059205,2.296870056888308,1.9976109939960218,APBB1IP CDKN1A ITGAL SCD TNFAIP3 ITGAX,0.26580786361707753
64,TPDE,JUN,0.0032856798915836378,3.621635478082543,8,249,47,5298,9.80214761046781e-22,0.396769289150696,2.15738207139032,1.9996888484466215,SERPINE1 TFPI2 TGFB1 GJA1 ETS1 RUNX2 ITGAX MMP9,0.02278071391497989
65,TPDE,SPI1,0.019285303099033934,2.5697943288304734,8,249,66,5279,2.01922340927798e-50,0.794701679252066,2.203263214884773,1.9982147554829441,CYBB APBB1IP IFIT3 NCF1 ERAP2 FCGR1A HCK ITGAM,0.07714121239613574
66,TPDE,CEBPB,0.0689558667537581,3.495406824146982,3,254,18,5327,3.93915495535251e-23,0.545152846372721,2.0677435859468365,2.00385176801768,ADM F8 CDKN1A,0.17928525355977107
67,TPDE,HIF1A,0.006695171265377753,2.581702849995533,11,246,91,5254,5.29776789954827e-24,0.666442473694808,2.619355561119929,1.977108409195171,ENO1 PGK1 SERPINE1 PGAM1 CA9 CDKN1A ETS1 ADM FLT1 TLR2 ANGPT2,0.03991390722147506
68,MDE_TMDS,RARA,0.47817004289553783,1.194366982710541,4,1304,11,4283,5.38152239088031e-33,0.574999243677336,1.2977405520364824,1.3328174101024373,CXCR5 PLAAT4 TPO CEBPE,0.7104240637305133
69,MDE_TMDS,SP3,0.2559837206300879,1.370698510529019,10,1298,24,4270,6.68528114306088e-05,0.116644919093851,3.1181039639177213,1.3224407244216894,F2 TIMP1 TNF PADI1 PADI3 SLC1A3 CD14 UBC F2R IGFBP1,0.44370511575881905
70,MDE_TMDS,TCF7L2,0.3530955396062466,1.642911877394636,3,1305,6,4288,0.0172213376303996,0.147008833752847,1.4551611298010834,1.3325260036743156,LEF1 SP5 CXCL8,0.5746211649941247
71,MDE_TMDS,SMAD3,0.5165456526679326,1.0946533640317218,5,1303,15,4279,0.0016646813909172,0.075823141555797,2.606240969582094,1.3290753599416194,TIMP1 COL6A3 EPO PTHLH FOXP3,0.7461214982981249
72,MDE_TMDS,NFKB1,0.08089090276926349,1.4091201766085637,29,1279,68,4226,4.45578234588058e-48,0.41201359702745,2.0215943900530355,1.3210886405101159,CD80 TNF MYB BCL2 PTAFR CSF2 CD40LG CD86 CXCL8 CCL22 IL10 IRF1 NOD2 VEGFC NOS2 CCR7 IRF7 PTHLH BCL2A1 BRCA1 EBI3 IL1RN IL1B IFNG IL6 IL2RA CD69 LTA FASLG,0.19564311367449774
73,MDE_TMDS,STAT3,0.35026676729862816,1.1873444873444874,13,1295,36,4258,0.014966241458555,0.0457384406088927,2.0632728716114177,1.3272505537004262,OSM TIMP1 CYP19A1 IL10 IRF1 HAMP SAA1 IL6 BCL2 IL2RA LBP GFAP CFB,0.5746211649941247
74,MDE_TMDS,ETS1,0.6057040351459697,0.9590141433430805,19,1289,65,4229,4.38650979703114e-47,0.614405989748941,2.3206655887143044,1.3218554258555448,TNF CD5 MYB PF4 BCL2 CSF2 ABCC1 GZMB CD6 IL10 CD3D GRPR TNFSF14 IL2RB PTHLH IER5 MMP1 CSF3R FASLG,0.8399095954024114
75,MDE_TMDS,ATF1,0.4243969022982411,1.4078817733990148,3,1305,7,4287,0.0568313244092027,0.044769764236419,1.3830889468155565,1.3326501946846294,CIITA IL10 BCL2,0.6396706933190881
76,MDE_TMDS,MYB,0.5567429112740367,1.0945083014048531,3,1305,9,4285,0.0502692663394061,0.170321666067363,1.1190933939140966,1.3331050979923287,BCL2 ELANE CD34,0.7824494969256732
77,MDE_TMDS,FOS,0.20949918847795954,1.3804707933740192,13,1295,31,4263,0.0224714868178633,0.128423284470485,1.9394677732217716,1.3281803435785693,NOS2 IL1A CD69 CSF2 NGF IL4R IL2RA CD40LG IL1B FASLG CXCL8 IL6 MMP1,0.3692867051136914
78,MDE_TMDS,TP53,0.999998634650741,0.2660126702968409,9,1299,109,4185,3.97644505267409e-08,0.238690104279036,2.0153984466845047,1.3291957750813983,PRDM1 PLK2 BNIP3L BBC3 DDIT4 PTTG1 ABCC1 IL1B STEAP3,0.9999999999993968
79,MDE_TMDS,IRF1,0.8792533380338362,0.5783637592968222,3,1305,17,4277,8.63331708031588e-08,0.378570602762278,1.8306554459473166,1.3318789715385093,CIITA IL10 IL27,0.9999999999993968
80,MDE_TMDS,SP1,0.913666238153963,0.7674632352941176,28,1280,119,4175,8.762856822402429e-11,0.177580053937431,2.526759047777955,1.3132540806810045,SPN TNF BCL2 PTTG1 KRT5 IL10 EPO MPG PADI3 ATM UBC TERT IGFBP1 TNFSF14 TIMP1 IL2RB IFNGR1 PTHLH CD28 BRCA1 CD14 PTK6 CYP19A1 IL1A PADI1 PNOC F2R FASLG,0.9999999999993968
81,MDE_TMDS,EPAS1,0.18672569332492583,2.192229038854806,4,1304,6,4288,3.984095469298899e-12,0.527854460189696,3.818767374014093,1.327021946143868,EGLN3 TERT POU5F1 EPO,0.3406924930840752
82,MDE_TMDS,USF1,0.62908445368663,0.9376782971253017,6,1302,21,4273,1.26843891787938e-12,0.145178167325904,2.4899029351552633,1.3287421393414585,ABCA1 PF4 SLC1A3 CIITA IFNG TERT,0.8608524103080201
83,MDE_TMDS,CTCF,0.7745440971544222,0.7945920745920746,8,1300,33,4261,1.6173665678334301e-15,0.238267853589124,1.9344969519759738,1.3299638710660016,CD80 CIDEB KSR1 BBC3 CHRNA6 CSF2 C1R GAS7,0.9999999999993968
84,MDE_TMDS,AR,0.9981583239205803,0.35517385839966487,6,1302,55,4239,9.64284324854577e-08,0.219801156064963,1.7958324837261,1.331138239864229,PRAME ATM CDC6 ATP2B4 PMEPA1 UBC,0.9999999999993968
85,MDE_TMDS,RELA,0.3536130246117691,1.132293935572624,21,1287,61,4233,9.72608286814249e-39,0.234476733788806,2.1345582562729164,1.3229643252493646,CCR5 TNF BCL2 NCAM1 CSF2 CD40LG CD86 IL10 IRF1 NOS2 CCL20 IRF7 PTHLH BCL2A1 EBI3 IFNG IL1B IL2RA IL6 CD69 CXCL8,0.5746211649941247
86,MDE_TMDS,NFATC2,0.02032844217451693,5.488616014325914,5,1303,3,4291,2.74867382708386e-50,0.698960254105238,2.506811537286918,1.3293612410005473,FOXP3 CSF2 CD40LG IFNG TERT,0.07830214763517632
87,MDE_TMDS,EGR1,0.9568297964409862,0.5682943143812709,8,1300,46,4248,3.25334724953471e-07,0.189255434634112,2.0336006802729027,1.3295071718572602,TNF TPO IL2RB BCL2 CD28 IFNG FASLG ACHE,0.9999999999993968
88,MDE_TMDS,STAT1,0.9916909872911709,0.6351773978826364,29,1279,148,4146,8.47761324160248e-46,0.911076267529669,1.920223533099974,1.3228027832807505,CCR1 CCR5 CLIC2 HLA-DMA BCL2 CEBPE CD86 HLA-DQA2 AIM2 IL10 IRF1 ZNF114 VEGFC ETV7 TNFSF13B NOS2 TIMP1 IRF7 IL12RB2 IRF8 IL1B IL2RA ZNF267 CYP19A1 EGLN3 IL12RB1 FOXP3 CIITA LY96,0.9999999999993968
89,MDE_TMDS,REL,0.12523639728112307,2.3500712641157766,5,1303,7,4287,3.36382068027211e-27,0.298472584202324,1.9977470815976883,1.3308249110859103,CSF2 CD40LG IL1B IFNG IL2RA,0.26580786361707753
90,MDE_TMDS,STAT5B,0.4927241872277344,1.2316091954022987,3,1305,8,4286,3.12343563451006e-45,0.272245566343044,2.6364259764015334,1.3304905099696622,OSM IL2RA IFNG,0.7217368376293575
91,MDE_TMDS,FOXA1,0.14408887265977297,3.2881226053639847,3,1305,3,4291,9.80513126179559e-08,0.215918621908594,2.4392297773656066,1.330830308129977,BRCA1 APOB IFI27,0.28817774531954593
92,MDE_TMDS,ELK1,0.3006680150888273,1.64340490797546,4,1304,8,4286,4.94457291264297e-06,0.226785490448757,2.63156801935839,1.329751140062617,F2 LY96 TNF DDIT4,0.512614320807181
93,MDE_TMDS,FOSL2,0.14408887265977297,3.2881226053639847,3,1305,3,4291,4.67914536813266e-30,0.602683229408131,1.3763334722061102,1.3326618353645998,NOS2 CCR4 BRCA1,0.28817774531954593
94,MDE_TMDS,CEBPA,0.35983233347517635,1.1360603709711545,19,1289,55,4239,4.56409218857457e-19,0.430720529059205,2.3741529655369815,1.3212662895311214,HAMP CXCR2 BCL2 UHRF1 ABCC1 TF IL10 EPO LBP IGFBP1 CETP ELANE IL6 XDH IL1A APOB CSF3R SAA1 CXCL8,0.5757317335602822
95,MDE_TMDS,USF2,0.5338801007335491,1.0945807770961145,4,1304,12,4282,6.513602018301431e-09,0.110473909864558,2.363739555622125,1.330366837680401,TERT BRCA1 PF4 ABCA1,0.7605963078943714
96,MDE_TMDS,STAT5A,0.12523639728112307,2.3500712641157766,5,1303,7,4287,1.08629044837493e-35,0.38177528347117,2.058269127435498,1.3306508971530817,OSM IRF1 BCL2 IFNG IL2RA,0.26580786361707753
97,MDE_TMDS,JUND,0.060144157995446194,3.291634689178818,5,1303,5,4289,5.8892169933456e-14,0.274270784794311,1.5273323947184738,1.332177454751463,NOS2 MYB CCR4 CD40LG IL6,0.16460506398753696
98,MDE_TMDS,JUN,0.4062027096222112,1.1222904964752893,14,1294,41,4253,9.80214761046781e-22,0.396769289150696,1.9990795685979923,1.3273445906508756,NOS2 TNF IER5 IL1A MYB CSF2 NGF BRCA1 IFNG FASLG IL1B CXCL8 IL6 MMP1,0.6212512029516172
99,MDE_TMDS,CREB1,0.4056589001613107,1.2106072252113758,7,1301,19,4275,5.870639375542189e-18,0.218107377384262,1.8009085193945185,1.330850256851252,CYP19A1 IL10 BCL2 CIITA IFNG HLA-DQB1 IL6,0.6212512029516172
100,MDE_TMDS,SPI1,0.1849840537471858,1.3056691735937018,21,1287,53,4241,2.01922340927798e-50,0.794701679252066,1.8681750392464356,1.3262110156484106,TNF CTSE CD22 MYB CXCR2 CSF2 CD86 PRTN3 P2RY10 CXCR1 PPBP ELANE NCF4 IL1B CD14 CD33 CSF3R CIITA PTPRC LY96 TLR4,0.3406924930840752
101,MDE_TMDS,CEBPB,0.09398551435123387,2.026508875739645,8,1300,13,4281,3.93915495535251e-23,0.545152846372721,2.379966530216132,1.3279110158667382,TNF IL10 CSF3R SAA1 IL1B CXCL8 FASLG IL6,0.21721096650062938
102,MDE_TMDS,HIF1A,0.8978818193448015,0.7478385224373054,19,1289,83,4211,5.29776789954827e-24,0.666442473694808,2.7235050661050018,1.3174183533509516,CP TLR6 PFKFB4 TF EPO BNIP3L TERT IGFBP1 NOS2 TIMP1 ABCA1 IL1B APLN NPM1 EGLN3 SLC11A1 PPP1R3C DDIT4 TLR4,0.9999999999993968
103,MDS_TMDE,HNF4A,0.7450592099829988,0.772901921132457,3,460,43,5096,8.78325240569214e-26,-0.531437198976817,-3.3518929941942535,-1.2598792522165612,PROZ SHBG APOA1,0.9808374409902769
