Regulatory Cluster label,Cell type,p-value,odds-ratio,genes in cell type and cluster,genes in cluster but not cell type,genes in cell type but not cluster,genes not in cell type or cluster,gene_ids,gene_names,p.adj
MDS (+),CD45- Myofibroblast,0.002487404930243206,7.868421052631579,6,4,57,299,ENSG00000127955 ENSG00000134504 ENSG00000109654 ENSG00000074527 ENSG00000173598 ENSG00000143416,GNAI1 KCTD1 TRIM2 NTN4 NUDT4 SELENBP1,0.01720455076751551
MDS (+),CD45- PAX8+ renal epithelium,0.0037184791338615137,11.805194805194805,9,1,154,202,ENSG00000127955 ENSG00000126562 ENSG00000134504 ENSG00000005108 ENSG00000109654 ENSG00000139344 ENSG00000114378 ENSG00000173598 ENSG00000143416,GNAI1 WNK4 KCTD1 THSD7A TRIM2 AMDHD1 HYAL1 NUDT4 SELENBP1,0.02140545280813339
MDS (+),TAM ISGhi,0.0013955238567586,8.891891891891891,7,3,74,282,ENSG00000127955 ENSG00000005108 ENSG00000109654 ENSG00000074527 ENSG00000114378 ENSG00000173598 ENSG00000143416,GNAI1 THSD7A TRIM2 NTN4 HYAL1 NUDT4 SELENBP1,0.012869831123440421
MDS (-),CD45- PAX8+ renal epithelium,0.0016152326750084078,7.986754966887418,12,2,151,201,ENSG00000130413 ENSG00000099812 ENSG00000159166 ENSG00000182795 ENSG00000198203 ENSG00000127831 ENSG00000088899 ENSG00000127324 ENSG00000143412 ENSG00000175707 ENSG00000145626 ENSG00000143627,STK33 MISP LAD1 C1orf116 SULT1C2 VIL1 LZTS3 TSPAN8 ANXA9 KDF1 UGT3A1 PKLR,0.013406431202569784
MDE (+),CD45- Myofibroblast,0.008392043632662828,3.4404761904761907,9,14,54,289,ENSG00000116991 ENSG00000140939 ENSG00000024422 ENSG00000138722 ENSG00000105974 ENSG00000132639 ENSG00000091127 ENSG00000173269 ENSG00000173548,SIPA1L2 NOL3 EHD2 MMRN1 CAV1 SNAP25 PUS7 MMRN2 SNX33,0.03869664563950082
MDE (+),CD45- Vascular Endothelium,0.0004182745130855559,4.944281524926686,12,11,62,281,ENSG00000116991 ENSG00000024422 ENSG00000138722 ENSG00000105974 ENSG00000104881 ENSG00000173269 ENSG00000173548 ENSG00000179403 ENSG00000183688 ENSG00000170962 ENSG00000185100 ENSG00000138411,SIPA1L2 EHD2 MMRN1 CAV1 PPP1R13L MMRN2 SNX33 VWA1 RFLNB PDGFD ADSS1 HECW2,0.00578613076435019
MDE (+),TAM ISGint,0.0038684553267710944,4.280701754385965,8,15,38,305,ENSG00000116991 ENSG00000024422 ENSG00000138722 ENSG00000105974 ENSG00000173269 ENSG00000179403 ENSG00000170962 ENSG00000138411,SIPA1L2 EHD2 MMRN1 CAV1 MMRN2 VWA1 PDGFD HECW2,0.02140545280813339
MDE (-),TAM HLAhi,0.00248677873253437,3.255731922398589,13,27,42,284,ENSG00000160255 ENSG00000168961 ENSG00000131446 ENSG00000158869 ENSG00000095970 ENSG00000181467 ENSG00000103490 ENSG00000132965 ENSG00000122986 ENSG00000100364 ENSG00000089127 ENSG00000059377 ENSG00000161921,ITGB2 LGALS9 MGAT1 FCER1G TREM2 RAP2B PYCARD ALOX5AP HVCN1 KIAA0930 OAS1 TBXAS1 CXCL16,0.01720455076751551
TMDE (+),CD45- Myofibroblast,0.004128883909903679,5.285714285714286,7,7,56,296,ENSG00000198680 ENSG00000074657 ENSG00000011638 ENSG00000119640 ENSG00000151364 ENSG00000138386 ENSG00000172037,TUSC1 ZNF532 LDAF1 ACYP1 KCTD14 NAB1 LAMB2,0.021418585282625333
TMDE (+),CD45- Vascular Endothelium,0.01080115156598511,4.253731343283582,7,7,67,285,ENSG00000101871 ENSG00000198680 ENSG00000116016 ENSG00000182621 ENSG00000074657 ENSG00000136160 ENSG00000172037,MID1 TUSC1 EPAS1 PLCB1 ZNF532 EDNRB LAMB2,0.047183977893513904
TPDE (+),CD45- Vascular Endothelium,4.129717663137365e-06,6.40080971659919,17,13,57,279,ENSG00000136960 ENSG00000185585 ENSG00000249751 ENSG00000148926 ENSG00000081189 ENSG00000164283 ENSG00000064989 ENSG00000113555 ENSG00000157510 ENSG00000102755 ENSG00000177469 ENSG00000176435 ENSG00000152661 ENSG00000176973 ENSG00000128606 ENSG00000152583 ENSG00000106236,ENPP2 OLFML2A ECSCR ADM MEF2C ESM1 CALCRL PCDH12 AFAP1L1 FLT1 CAVIN1 CLEC14A GJA1 FAM89B LRRC17 SPARCL1 NPTX2,0.00017138328302020064
TPDE (+),TAM ISGhi,9.005552058867898e-05,4.764835164835165,16,14,65,271,ENSG00000136960 ENSG00000185585 ENSG00000148926 ENSG00000107738 ENSG00000081189 ENSG00000113555 ENSG00000157510 ENSG00000174705 ENSG00000177469 ENSG00000176435 ENSG00000152661 ENSG00000119630 ENSG00000128606 ENSG00000152583 ENSG00000100504 ENSG00000106236,ENPP2 OLFML2A ADM VSIR MEF2C PCDH12 AFAP1L1 SH3PXD2B CAVIN1 CLEC14A GJA1 PGF LRRC17 SPARCL1 PYGL NPTX2,0.0018686520522150887
TPDE (+),TAM ISGint,1.310954888368379e-07,9.838709677419354,15,15,31,305,ENSG00000136960 ENSG00000185585 ENSG00000079689 ENSG00000081189 ENSG00000164283 ENSG00000064989 ENSG00000113555 ENSG00000157510 ENSG00000102755 ENSG00000177469 ENSG00000176435 ENSG00000249751 ENSG00000128606 ENSG00000152583 ENSG00000106236,ENPP2 OLFML2A SCGN MEF2C ESM1 CALCRL PCDH12 AFAP1L1 FLT1 CAVIN1 CLEC14A ECSCR LRRC17 SPARCL1 NPTX2,1.0880925573457544e-05
TPDE (-),TAM HLAhi,0.003461192936460436,3.4523809523809526,11,21,44,290,ENSG00000254087 ENSG00000101336 ENSG00000129667 ENSG00000136235 ENSG00000146070 ENSG00000088827 ENSG00000119922 ENSG00000136404 ENSG00000136040 ENSG00000140678 ENSG00000012779,LYN HCK RHBDF2 GPNMB PLA2G7 SIGLEC1 IFIT2 TM6SF1 PLXNC1 ITGAX ALOX5,0.02140545280813339
TPDE (-),TAM HLAint,0.006145745498138681,3.7901234567901234,8,24,27,307,ENSG00000254087 ENSG00000129667 ENSG00000136235 ENSG00000146070 ENSG00000136404 ENSG00000136040 ENSG00000140678 ENSG00000012779,LYN RHBDF2 GPNMB PLA2G7 TM6SF1 PLXNC1 ITGAX ALOX5,0.030005698608559443
TPDE (-),TAM/TCR (Ambiguos),0.0002828668657745812,6.143478260869565,9,23,20,314,ENSG00000101336 ENSG00000129667 ENSG00000136235 ENSG00000146070 ENSG00000088827 ENSG00000136404 ENSG00000136040 ENSG00000140678 ENSG00000012779,HCK RHBDF2 GPNMB PLA2G7 SIGLEC1 TM6SF1 PLXNC1 ITGAX ALOX5,0.004695589971858048
TPDE (-),cDC2,0.0006945731000125332,4.780564263322884,10,22,29,305,ENSG00000254087 ENSG00000101336 ENSG00000129667 ENSG00000136235 ENSG00000146070 ENSG00000088827 ENSG00000136404 ENSG00000136040 ENSG00000140678 ENSG00000012779,LYN HCK RHBDF2 GPNMB PLA2G7 SIGLEC1 TM6SF1 PLXNC1 ITGAX ALOX5,0.007206195912630031
TPDS (+),CD45- Myofibroblast,0.0006366666993789302,3.836734693877551,14,21,49,282,ENSG00000138759 ENSG00000123094 ENSG00000175745 ENSG00000153707 ENSG00000099864 ENSG00000165959 ENSG00000119673 ENSG00000008311 ENSG00000115896 ENSG00000085276 ENSG00000175600 ENSG00000072954 ENSG00000144366 ENSG00000100116,FRAS1 RASSF8 NR2F1 PTPRD PALM CLMN ACOT2 AASS PLCL1 MECOM SUGCT TMEM38A GULP1 GCAT,0.007206195912630031
TPDS (-),CD45- PAX8+ renal epithelium,1.7676752889033874e-05,3.675907258064516,39,16,124,187,ENSG00000167608 ENSG00000132361 ENSG00000156709 ENSG00000184434 ENSG00000009765 ENSG00000243989 ENSG00000144040 ENSG00000170482 ENSG00000111110 ENSG00000118514 ENSG00000181291 ENSG00000135069 ENSG00000086991 ENSG00000211452 ENSG00000104892 ENSG00000105519 ENSG00000186115 ENSG00000162896 ENSG00000173898 ENSG00000130529 ENSG00000140263 ENSG00000171433 ENSG00000158296 ENSG00000070087 ENSG00000147676 ENSG00000185813 ENSG00000204385 ENSG00000127884 ENSG00000132855 ENSG00000183048 ENSG00000186529 ENSG00000135447 ENSG00000096696 ENSG00000211445 ENSG00000136463 ENSG00000139410 ENSG00000140832 ENSG00000154277 ENSG00000180432,TMC4 CLUH AIFM1 LRRC19 IYD ACY1 SFXN5 SLC23A1 PPM1H ALDH8A1 TMEM132E PSAT1 NOX4 DIO1 KLC3 CAPS CYP4F2 PIGR SPTBN2 TRPM4 SORD GLOD5 SLC13A3 PFN2 MAL2 PCYT2 SLC44A4 ECHS1 ANGPTL3 SLC25A10 CYP4F3 PPP1R1A DSP GPX3 TACO1 SDSL MARVELD3 UCHL1 CYP8B1,0.0004890568299299372
