TPDS (+),TAM HLAhi,0.16023953756957401,1.5486083098023395,11,67,37,349,ENSG00000112394 ENSG00000167107 ENSG00000005249 ENSG00000123836 ENSG00000162390 ENSG00000108176 ENSG00000111110 ENSG00000092068 ENSG00000177807 ENSG00000139410 ENSG00000135540,SLC16A10 ACSF2 PRKAR2B PFKFB2 ACOT11 DNAJC12 PPM1H SLC7A8 KCNJ10 SDSL NHSL1,0.4506847952618979
TPDS (+),TAM HLAint,0.21142612868286684,1.4936886395511921,9,69,31,355,ENSG00000112394 ENSG00000079156 ENSG00000005249 ENSG00000123836 ENSG00000162390 ENSG00000111110 ENSG00000092068 ENSG00000139410 ENSG00000135540,SLC16A10 OSBPL6 PRKAR2B PFKFB2 ACOT11 PPM1H SLC7A8 SDSL NHSL1,0.48961840326558637
TPDS (+),TAM ISGhi,0.9851935237555021,0.49114331723027377,9,69,81,305,ENSG00000011465 ENSG00000005249 ENSG00000167107 ENSG00000073792 ENSG00000175866 ENSG00000111110 ENSG00000139410 ENSG00000135540 ENSG00000145362,DCN PRKAR2B ACSF2 IGF2BP2 BAIAP2 PPM1H SDSL NHSL1 ANK2,0.9999999999276121
TPDS (+),TAM ISGint,0.961914856226669,0.5123456790123457,6,72,54,332,ENSG00000011465 ENSG00000014257 ENSG00000111110 ENSG00000111907 ENSG00000135540 ENSG00000145362,DCN ACP3 PPM1H TPD52L1 NHSL1 ANK2,0.9999999999276121
TPDS (+),TAM/TCR (Ambiguos),0.09646253103060812,1.8834782608695653,9,69,25,361,ENSG00000112394 ENSG00000079156 ENSG00000005249 ENSG00000167107 ENSG00000123836 ENSG00000162390 ENSG00000014257 ENSG00000139410 ENSG00000135540,SLC16A10 OSBPL6 PRKAR2B ACSF2 PFKFB2 ACOT11 ACP3 SDSL NHSL1,0.3143963974330931
TPDS (+),cDC1,0.3403128606830304,1.400304414003044,5,73,18,368,ENSG00000005249 ENSG00000167107 ENSG00000166123 ENSG00000073792 ENSG00000014257,PRKAR2B ACSF2 GPT2 IGF2BP2 ACP3,0.6371815263852485
TPDS (+),cDC2,0.16805397586968593,1.605697151424288,9,69,29,357,ENSG00000112394 ENSG00000005249 ENSG00000167107 ENSG00000123836 ENSG00000073792 ENSG00000162390 ENSG00000175866 ENSG00000014257 ENSG00000139410,SLC16A10 PRKAR2B ACSF2 PFKFB2 IGF2BP2 ACOT11 BAIAP2 ACP3 SDSL,0.4506847952618979
TPDS (-),CD45- Myofibroblast,0.11477957179112054,1.867007672634271,8,23,68,365,ENSG00000112902 ENSG00000196586 ENSG00000182752 ENSG00000165959 ENSG00000188176 ENSG00000165795 ENSG00000167434 ENSG00000160808,SEMA5A MYO6 PAPPA CLMN SMTNL2 NDRG2 CA4 MYL3,0.33668674392062026
TPDS (-),CD45- PAX8+ renal epithelium,2.735552256642965e-07,11.715277777777779,28,3,192,241,ENSG00000112902 ENSG00000095932 ENSG00000148942 ENSG00000204385 ENSG00000010932 ENSG00000147647 ENSG00000072415 ENSG00000140284 ENSG00000166126 ENSG00000166415 ENSG00000165376 ENSG00000124602 ENSG00000182752 ENSG00000162460 ENSG00000117472 ENSG00000188176 ENSG00000151150 ENSG00000196586 ENSG00000140832 ENSG00000165959 ENSG00000157551 ENSG00000168065 ENSG00000119411 ENSG00000145692 ENSG00000107611 ENSG00000108187 ENSG00000160808 ENSG00000143375,SEMA5A SMIM24 SLC5A12 SLC44A4 FMO1 DPYS PALS1 SLC27A2 AMN WDR72 CLDN2 UNC5CL PAPPA TMEM82 TSPAN1 SMTNL2 ANK3 MYO6 MARVELD3 CLMN KCNJ15 SLC22A11 BSPRY BHMT CUBN PBLD MYL3 CGN,1.2036429929229046e-05
TPDS (-),CD45- Vascular Endothelium,0.7347802042758652,0.8109360518999074,5,26,83,350,ENSG00000196586 ENSG00000204385 ENSG00000165795 ENSG00000167434 ENSG00000072415,MYO6 SLC44A4 NDRG2 CA4 PALS1,0.9967018170502946
TPDS (-),CD45- ccRCC CA9+,0.5340260115256672,1.03594351732991,12,19,164,269,ENSG00000112902 ENSG00000124602 ENSG00000182752 ENSG00000165959 ENSG00000148942 ENSG00000168065 ENSG00000188176 ENSG00000108187 ENSG00000072415 ENSG00000166415 ENSG00000165376 ENSG00000143375,SEMA5A UNC5CL PAPPA CLMN SLC5A12 SLC22A11 SMTNL2 PBLD PALS1 WDR72 CLDN2 CGN,0.8532315962658912
TPDS (-),TAM ISGhi,0.7545128791598659,0.7873303167420814,5,26,85,348,ENSG00000112902 ENSG00000196586 ENSG00000165959 ENSG00000165795 ENSG00000167434,SEMA5A MYO6 CLMN NDRG2 CA4,0.9967018170502946
TPDS (-),TAM ISGint,0.588284943724197,0.9973544973544973,4,27,56,377,ENSG00000112902 ENSG00000165959 ENSG00000165795 ENSG00000196586,SEMA5A CLMN NDRG2 MYO6,0.8938608038381126
